{
  "identityId": "id-demo",
  "questionSetVersion": "set-v1",
  "normalizationVersion": "nfkc-lower-v1",
  "status": "active",
  "questions": [
    {
      "questionId": "q-1",
      "versionTag": "v1",
      "promptRef": "prompt-1",
      "promptText": "Question 1",
      "options": ["answer-1", "alt-1"],
      "answer": "answer-1",
      "status": "active"
    },
    {
      "questionId": "q-2",
      "versionTag": "v1",
      "promptRef": "prompt-2",
      "promptText": "Question 2",
      "options": ["answer-2", "alt-2"],
      "answer": "answer-2",
      "status": "active"
    },
    {
      "questionId": "q-3",
      "versionTag": "v1",
      "promptRef": "prompt-3",
      "promptText": "Question 3",
      "options": ["answer-3", "alt-3"],
      "answer": "answer-3",
      "status": "active"
    },
    {
      "questionId": "q-4",
      "versionTag": "v1",
      "promptRef": "prompt-4",
      "promptText": "Question 4",
      "options": ["answer-4", "alt-4"],
      "answer": "answer-4",
      "status": "active"
    },
    {
      "questionId": "q-5",
      "versionTag": "v1",
      "promptRef": "prompt-5",
      "promptText": "Question 5",
      "options": ["answer-5", "alt-5"],
      "answer": "answer-5",
      "status": "active"
    },
    {
      "questionId": "q-6",
      "versionTag": "v1",
      "promptRef": "prompt-6",
      "promptText": "Question 6",
      "options": ["answer-6", "alt-6"],
      "answer": "answer-6",
      "status": "active"
    },
    {
      "questionId": "q-7",
      "versionTag": "v1",
      "promptRef": "prompt-7",
      "promptText": "Question 7",
      "options": ["answer-7", "alt-7"],
      "answer": "answer-7",
      "status": "active"
    },
    {
      "questionId": "q-8",
      "versionTag": "v1",
      "promptRef": "prompt-8",
      "promptText": "Question 8",
      "options": ["answer-8", "alt-8"],
      "answer": "answer-8",
      "status": "active"
    },
    {
      "questionId": "q-9",
      "versionTag": "v1",
      "promptRef": "prompt-9",
      "promptText": "Question 9",
      "options": ["answer-9", "alt-9"],
      "answer": "answer-9",
      "status": "active"
    }
  ]
}
